{
  "run_id": "rag-topk-recall-treatment",
  "experiment_id": "rag-topk-recall",
  "experiment_type": "rag",
  "created_at": "2026-01-05T02:00:00Z",
  "config_hash": "sha256:bbb222",
  "config_ref": "configs/rag-treatment.yaml",
  "schema_version": "1",
  "baseline_run": "rag-topk-recall-baseline",
  "treatment": "top_k",
  "status": "completed",
  "metrics": { "recall_at_10": 0.71, "latency_ms": 210 },
  "metric_definitions": { "recall_at_10": "metrics/recall_at_10.json", "latency_ms": "metrics/latency_ms.json" },
  "artifacts": ["artifacts/rag-topk-recall-treatment/recall_curve.png"]
}
