{
  "run_id": "rag-topk-recall-baseline",
  "experiment_id": "rag-topk-recall",
  "experiment_type": "rag",
  "created_at": "2026-01-05T01:00:00Z",
  "config_hash": "sha256:aaa111",
  "config_ref": "configs/rag-baseline.yaml",
  "schema_version": "1",
  "baseline_run": null,
  "status": "completed",
  "metrics": { "recall_at_10": 0.62, "latency_ms": 180 },
  "metric_definitions": { "recall_at_10": "metrics/recall_at_10.json", "latency_ms": "metrics/latency_ms.json" },
  "artifacts": ["artifacts/rag-topk-recall-baseline/recall_curve.png"]
}
