{
  "run_id": "sim-queueing-baseline",
  "experiment_id": "sim-queueing",
  "experiment_type": "simulation",
  "created_at": "2026-01-07T01:00:00Z",
  "config_hash": "sha256:eee555",
  "config_ref": "configs/queue-baseline.yaml",
  "schema_version": "1",
  "baseline_run": null,
  "status": "completed",
  "metrics": { "avg_wait_time_ms": 95.0 },
  "metric_definitions": { "avg_wait_time_ms": "metrics/avg_wait_time_ms.json" },
  "artifacts": []
}
